,infoDayweek,infoDate,infoMonth,sunUp,sunDown,tempMax,tempMin,maxTemp,maxYear,minTemp,minYear,dayInfo,dayHistory,city
250,Пятница,8,сентября,06:06,19:11,+21°,+15°,31.5°, 1963,1.8°, 1953 ,"  В Полтаве облачная погода продержалась весь день. Ночью начался дождь, но ближе к утру он закончился. Больше в этот день осадков не было.  "," Народный прогноз погоды: 8 сентября отмечается день памяти святых Адриана и Наталии. Наши предки заметили, если в этот день холодный утренник, то будет ранняя и холодная зима. В прежние времена этот день был посвящен рябине, она считалась именинницей. Собирали рябину и калину, и примечали: ""Большой урожай рябины - к морозу"".",poltava
251,Суббота,9,сентября,06:08,19:09,+22°,+10°,33.0°, 1944,4.5°, 1970 ,"  В Полтаве ясная погода держалась с завидным постоянством, хотя днем была непродолжительная оккупация неба облаками. Без осадков.  "," Народный прогноз погоды: 9 сентября почитается память преподобного Пимена Великого. Наши предки погоду осени и зимы определяли по рябине: если она хорошо уродила - к дождливой осени, морозной зиме. Как известно, рябина является ценным питательным и лекарственным растением, поэтому с прежних времен ее активно использовали для лечения простудных заболеваний.",poltava
252,Воскресенье,10,сентября,06:09,19:07,+22°,+13°,32.0°, 1963,3.0°, 1968 ,  С утра и до самого вечера небо в Полтаве было скрыто за облаками. Без осадков.  ," Народный прогноз погоды: В этот день почитается память преподобного Саввы Крыпецкого. Наши предки славили урожай, начинались веселые осенние ярмарки. Люди не зря спешили справится с полевой работой, поскольку с этого времени нередко начинались осенние дожди. Если в этот день был слышен гром, то он предвещал теплую осень.",poltava
253,Понедельник,11,сентября,06:11,19:05,+27°,+12°,32.0°, 1963,3.0°, 1968 ,  В этот день в Полтаве небо оставалось ясным до самого позднего вечера. Без осадков.  ," Народный прогноз погоды: 11 сентября отмечается праздник Усекновение главы пророка Предтечи и Крестителя Господня Иоанна. День 11 сентября завершает лето: «Иван Постный пришел, лето красное увел». Наши предки в этот день следили за журавлями: если с Ивана Постного журавли потянули на юг, то осень будет короткая, а зима - ранняя.",poltava
254,Вторник,12,сентября,06:12,19:02,+30°,+15°,28.1°, 2005,4.7°, 1951 ,"  Весь день небо в Полтаве было ясным, но вечером погода сменилась на облачную. Без осадков.  "," Народный прогноз погоды: В этот день отмечается Перенесение мощей святого благоверного великого князя Александра Невского в Александро-Невскую лавру в Санкт-Петербурге. Наши предки заметили, что теплый вечер и звездная ночь 12 сентября обещают хороший урожаю следующего года, а теплый и сухой день указывают на позднюю зиму.",poltava
255,Среда,13,сентября,06:14,19:00,+27°,+19°,29.2°, 2005,3.1°, 1945 ,"  С самого утра небо в Полтаве покрылось облаками, которые продержались до конца дня. Без осадков.  "," Народный прогноз погоды: 13 сентября почитается память святого Киприана, епископа Карфагенского. В прежние времена в этот день наблюдали за обитателями водной стихии: если лягушки прыгают на берег и днем квакают, а рыбы выпрыгивают из воды - будет дождь. С этого времени на огородах убирают корнеплоды: морковь, свеклу, картофель.",poltava
256,Четверг,14,сентября,06:15,18:58,+24°,+15°,29.1°, 1994,3.2°, 1973 ,"  Днем в Полтаве было облачно, но к вечеру небо очистилось от туч и оставалось ясным до завершения дня. Без осадков.  "," Народный прогноз погоды: 14 сентября отмечается день памяти преподобного Симеона Столпника и матери его Марфы. С этого дня начинается старое Бабье лето, которое продолжается до 21 сентября. По этому дню наши предки определяли наступающую осень. Если первый день Бабьего лета ясен, то осень будет теплая; сухо - осень сухая; погода теплая - зима будет теплая. А если случится дождь, то вся осень дождливая будет.",poltava
257,Пятница,15,сентября,06:17,18:56,+27°,+16°,31.2°, 1994,4.1°, 1964 ,  В Полтаве облаков на небе в этот день никто так и не увидел. Без осадков.  ," Народный прогноз погоды: 15 сентября почитается память святого Маманта, отца его Феодота и матери Руфины. В это время происходит переход среднесуточной температуры воздуха через 10ºС. С середины сентября сбрасывает листья черемуха, пустеют пастбища. В старину наши предки следили за закатом: если в этот вечер он будет красный, то морозов долго ждать не придется.",poltava
258,Суббота,16,сентября,06:18,18:54,+24°,+11°,30.8°, 1994,1.6°, 1953 ,"  Вечер в Полтаве оставался ясным, несмотря на то, что днем небо было затянуто тучами. Без осадков.  "," Народный прогноз погоды: В этот день почитается память святых Домны и Василисы Великой. 16 сентября было принято «прибиранье рухляди в доме», чтобы приобрести благополучие на осень. В старину в этот день наблюдали за муравейниками: если муравьи соорудили себе большие кучи к осени, то следует готовиться к суровой зиме.",poltava
259,Воскресенье,17,сентября,06:20,18:52,+29°,+13°,28.9°, 1955,1.3°, 1952 ,"  Утро в Полтаве было безоблачным, и до конца дня небо оставалось ясным. Без осадков.  "," Народный прогноз погоды: 17 сентября отмечается день памяти иконы Божией Матери, именуемой «Неопалимая Купина». В этот день наши предки на заре ходили слушать последние голоса птиц, улетающих на юг. И следили за воронами: если вороны садятся головами в разные стороны — день будет безветренным, а если в одну, да как можно ближе к стволу дерева — надо ждать ветра.",poltava
260,Понедельник,18,сентября,06:21,18:49,+30°,+17°,29.9°, 1994,-1.0°, 1958 ,"  Утром на небе в Полтаве появились облака, но уже к середине дня исчезли, чтобы до самого вечера больше не возвращаться. Без осадков.  "," Народный прогноз погоды: 18 сентября почитается память преподобного Афанасия Брестского. Погоду в этот день наши предки определяли по рябине: если в лесу её много - осень будет дождливая, а мало - сухая. Если листья на рябине пожелтели рано, осень будет ранняя и ранняя холодная зима.",poltava
261,Вторник,19,сентября,06:23,18:47,+22°,+11°,30.6°, 1994,-0.2°, 1958 ,"  Несмотря на то, что утром небо в Полтаве было покрыто облаками, день и вечер оставались ясными и безоблачными. Без осадков.  "," Народный прогноз погоды: В этот день почитается память архистратига Михаила. С 19 сентября начинались Михайловские заморозки по утрам: «Михаил заморозком землю прихватил». В старину наши предки зиму определяли по осиновым листьям: если они ложатся лицом вверх — к студеной зиме, изнанкой кверху — зима будет теплой, а если и так и сяк — то зима умеренная будет.",poltava
262,Среда,20,сентября,06:24,18:45,+28°,+13°,30.7°, 1994,-1.5°, 1949 ,"  Облака, которые появились в Полтаве на небе утром, продержались почти весь день, но к вечеру рассеялись. Без осадков.  "," Народный прогноз погоды: 20 сентября отмечается день памяти преподобного Луки. По луку определяли предстоящую зиму: если на луковице много ""одежки"" - быть зиме холодной. Для этого дня характерны моросящие дожди. Наши предки следили за еловыми шишками: если они выросли низко - быть ранним морозам, а если наверху - настоящие холода в конце зимы следует ждать.",poltava
263,Четверг,21,сентября,06:25,18:43,+31°,+17°,29.1°, 1994,2.7°, 1996 ,"  Вечером в Полтаве держалась пасмурная погода, днем было небольшое прояснение, но оно оказалось недолгим. Без осадков.  "," Народный прогноз погоды: 21 сентября отмечается праздник Рождества Пресвятой Богородицы. Наши предки приметили, если в этот день погода хорошая, то и осень будет хорошая. Следили также за животными: если после Малой Пречистой животное стремится на пастбище рано, то и зима будет ранняя.",poltava
264,Пятница,22,сентября,06:27,18:41,+29°,+17°,28.3°, 1975,0.1°, 1996 ,  В Полтаве ясное утро и погожий день плавно перетекли в пасмурный вечер. Без осадков.  ," Народный прогноз погоды: 22 сентября почитается память правоверных Иоакима и Анны, родителей Девы Марии. 22 сентября считается днем осеннего равноденствия. В это время ночь равняется с днем и увеличивается: все короче день, все длиннее вечера. В этот день наступает и астрономическое начало осени. Наши предки в этот день наблюдали за паутиной: если она была длинной, то осень будет ясной и снег нескоро выпадет.",poltava
265,Суббота,23,сентября,06:28,18:39,+21°,+13°,25.0°, 1983,1.3°, 1966 ,"  В Полтаве на протяжении всего дня стояла облачная погода. Ночью был дождь, которому утром на смену пришел дождь c грозой. Во второй половине дня осадков не наблюдалось.  "," Народный прогноз погоды: В этот день почитается память святителей Петра и Павла, епископов Никейских. О погоде судили по рябине. Если рябины в лесу много — осень будет дождливой, если же мало — сухой. Много ягод на рябине предвещает суровую зиму, поэтому и заготавливали тогда рябинный квас, чтобы в большие холода лечить простудные заболевания.",poltava
266,Воскресенье,24,сентября,06:30,18:36,+18°,+12°,25.9°, 1979,-0.6°, 1956 ,  На протяжении всего дня небо в Полтаве было покрыто облаками. Утром пошел дождь и закончился в середине дня. Больше осадков не наблюдалось.  ," Народный прогноз погоды: 24 сентября отмечается день преподобной Феодоры (Федоры) Александрийской. С этого дня начинается Золотая осень, которая продлится до 15 октября. На Федору наши предки наблюдали за пчелами: если они открывают в другой раз летку, то будет продолжительная и теплая осень. В это время бывают последние грозы перед началом зимы.",poltava
267,Понедельник,25,сентября,06:31,18:34,+22°,+12°,26.6°, 1953,-1.9°, 1956 ,"  В Полтаве все время стояла пасмурная погода, во второй половине дня небо прояснилось, чтобы вскоре снова спрятаться за облаками. Без осадков.  "," Народный прогноз погоды: 25 сентября почитается память святого Автонома (Артамона), епископа Италийского. Животная жизнь быстро замирает, осень вступает в свои права. Наши предки в этот день изучали листья березы и узнавали будущую весну: если они желтеют с верхушки - весна будет ранней, а если снизу, то – поздней.",poltava
268,Вторник,26,сентября,06:33,18:32,+18°,+7°,28.6°, 1984,0.2°, 1997 ,"  Ясная погода в Полтаве наблюдалась на протяжении всего дня, такой она и осталась до глубокого вечера. Без осадков.  "," Народный прогноз погоды: 26 сентября почитается память святого Корнилия сотника. К этому времени заканчивается формирование осенних стай грачей. Наши предки заметили: когда грачи улетают, уже можно ожидать снега. А если в этот день пойдет дождь, то погода в ближайшее время будет ненастной.",poltava
269,Среда,27,сентября,06:34,18:30,+13°,+7°,28.1°, 1999,1.0°, 1970 ,  Облачный день и пасмурный вечер пришли в Полтаве на смену ясному утру. Без осадков.  ," Народный прогноз погоды: 27 сентября отмечается праздник Воздвижения Честного и Животворящего Креста Господня. В народе этот день назывался Третьи осенины или Сдвижение (урожай к этому дню должен быть «сдвинут» в амбар). Если 27 сентября дует северный ветер, то лето будет теплым. В народе говорили: ""Воздвиженье осень навстречу зиме двигает"".",poltava
270,Четверг,28,сентября,06:36,18:28,+12°,+4°,23.9°, 1952,-0.1°, 1977 ,"  В Полтаве днем на небе появились облака, которые к вечеру рассеялись. Без осадков.  "," Народный прогноз погоды: 28 сентября почитается память святого Никиты, которого называли Никита Гусепролет: «Гуси летят – зимушку на хвосте тащат». Если гусь лапу поднимает – к стуже, на одной ноге стоит – к морозу, полощется в воде – к теплу, нос под крыло прячет – к ранней зиме. Если гуси в этот день полетят, то на Покров будет мороз, а нет, то зима наступит позже.",poltava
271,Пятница,29,сентября,06:37,18:25,+14°,+2°,25.3°, 1975,-3.0°, 1986 ,"  С утра небо в Полтаве было ясным, таким оно и оставалось до завершения дня. Без осадков.  "," Народный прогноз погоды: В этот день почитается память святой Евфимии Всехвальной. Если в этот день на дворе можно увидеть много тенетника, а скворцы не спешат отлетать – осень будет сухой и ""протяжливой"". Чем теплее и суше будет на Евфимию, тем позднее наступит зима, а сильных холодов можно не бояться.",poltava
272,Суббота,30,сентября,06:39,18:23,+8°,+2°,24.2°, 2005,-2.0°, 1996 ,"  С самого утра небо в Полтаве покрылось облаками, которые продержались до конца дня. Без осадков.  "," Народный прогноз погоды: 30 сентября отмечается день памяти святых Веры, Надежды, Любови и их матери Софии. Люди в этот день наблюдали за журавлями: если они полетят, то на Покров (14 октября) будет мороз, а нет, то зима будет позднее. С этого времени уже могут быть первые заморозки в воздухе ниже 2 градусов мороза. В этот день может быть как дождливая и холодная погода, так и ясная, солнечная.",poltava
273,Воскресенье,1,октября,06:40,18:21,+10°,+7°,30.7°, 1905,-1.1°, 1912 ,  В Полтаве солнце в этот день редко показывалось из-за облаков. Без осадков.  ," Народный прогноз погоды: 1 октября почитается память мученицы Ариадны. В народе этот день назывался Арина Шиповница, журавлиный лет. Если на Арину журавли полетят, то на Покров (14 октября) будет первый мороз; если нет, то до Артемьева дня (2 ноября) не будет ни одного мороза - «слякоть простоит». Какая погода на 1 октября, такая будет и на 1 апреля.",poltava
274,Понедельник,2,октября,06:42,18:19,+10°,+2°,27.7°, 1999,-1.9°, 1948 ,"  Утро в Полтаве было погожее - облака появились только во второй половине дня, но к вечеру снова рассеялись. Без осадков.  "," Народный прогноз погоды: В этот день почитается память мучеников Трофима, Савватия и Зосимы Пустынника. Со 2 октября проходили Трофимовские вечерки - выбор женихов. ""На Трофима не проходит счастье мимо: куда Трофим, туда и оно за ним"". В этот день бывал и первый снегопад. Если к этому дню лист с березы и дуба опал не чисто - надо ждать суровую зиму.",poltava
275,Вторник,3,октября,06:43,18:17,+12°,+1°,29.1°, 1999,-0.6°, 1979 ,"  Утром небо в Полтаве было ясное, а днем покрылось тучами, которые не исчезли до завершения дня. Без осадков.  "," Народный прогноз погоды: 3 октября отмечается день святого Евстафия Плакиды. В народе этот день назывался Астафьевы ветры или Астафий Ветряк. День, как правило, бывал ветренный, и по ветру судили о погоде: если ветер северный - близко стужа; южный ветер - к теплу; западный - к мокроте, дождям, а восточный - к ясной погоде.",poltava
276,Среда,4,октября,06:45,18:15,+14°,+3°,29.6°, 1999,-2.0°, 1998 ,"  Весь день в Полтаве было облачно. Весь день прошел без осадков, только вечером начался дождь.  "," Народный прогноз погоды: 4 октября почитается память святого апостола Кондрата. Погода в этот день имеет огромное значение, поскольку какой погода бывала в этот день - такой она останется и в следующие четыре недели, то есть весь октябрь. Однако ясная погода в этот день в сочетании с северо-восточным ветром обещает и холодную зиму.",poltava
277,Четверг,5,октября,06:46,18:13,+15°,+9°,27.7°, 1999,-0.1°, 1982 ,"  Облачная погода продержалась в Полтаве до самого вечера. Днем начался дождь, но он закончился до наступления вечера.  "," Народный прогноз погоды: В этот день почитается память святого пророка Ионы и Фоки, епископа Синопийского. С давних времен этот день называется Фока Ветроградарь. О том, когда ожидать первого снега, наши предки судили по березовым листьям: если до этого дня лист с березы не опал полностью, снег ляжет поздно.",poltava
