,infoDayweek,infoDate,infoMonth,sunUp,sunDown,tempMax,tempMin,maxTemp,maxYear,minTemp,minYear,dayInfo,dayHistory,city
172,Четверг,22,июня,04:32,20:54,+23°,+12°,33.6°, 1975,8.0°, 1959 ,"  Утром небо в Полтаве было ясное, а днем покрылось тучами, которые не исчезли до завершения дня. Без осадков.  "," Народный прогноз погоды: В этот день почитается память святителя Кирилла Александрийского. В прежние времена день 22 июня имел еще и такое название - Кирилл Конец Весны Начало Лету. Это второй день летнего солнцестояния, и это самый длинный день в году. По этому поводу наши предки говорили, что «На Кириллу солнышко отдает земле всю свою силу». По солнцу и о предстоящей погоде судили: если оно светит днем как бы сквозь оболочку - надо вскоре ожидать дождя.",poltava
173,Пятница,23,июня,04:33,20:55,+25°,+14°,34.6°, 1946,4.3°, 1983 ,"  Погода в Полтаве порадовала нас безоблачным утром, но со второй половины дня и до позднего вечера оставалась пасмурной. Утром и днем осадков не наблюдалось, а вечером шел дождь.  "," Народный прогноз погоды: 23 июня почитается память священномученика Тимофея Прусского. В народе день Тимофея назывался мышиный писк. По преданию, в этот день по земле ходят-бродят призраки. Старые люди верили и видели в эту пору несметные «стада мышей» на гумнах, что не предвещало ничего хорошего. Погоду в этот день предсказывал дым от костра: если он поднимается столбом - к ясной погоде, стелется по земле - к ненастью. А если на Тимофея стоит засуха, то в этот день добра не жди.",poltava
174,Суббота,24,июня,04:33,20:55,+22°,+17°,35.0°, 1946,6.3°, 1959 ,"  Весь день в Полтаве было облачно. Дождь начался еще до рассвета, но к середине дня прекратился.  "," Народный прогноз погоды: 24 июня отмечается день памяти апостолов Варфоломея и Варнавы. В прежние времена в этот день нельзя было рвать траву, поскольку люди верили, что по ней катается всякая нечистая сила. Солнечную погоду 24 июня предсказывал туман, который утром стелется по воде, и мокрица, которая остается раскрытой весь день. Наши предки заметили, если во время восхода солнца стоит духота, то хорошей погоды не ждать. Дождь предвещала чистая вода в водоемах и сильный запах травы и жимолости утром.",poltava
175,Воскресенье,25,июня,04:33,20:55,+25°,+17°,35.3°, 1946,9.0°, 1977 ,"  В Полтаве облачная погода продержалась весь день. Ночью был дождь, но уже к утру он закончился. Больше осадков не наблюдалось.  "," Народный прогноз погоды: 25 июня отмечается день памяти преподобных Петра Афонского и Онуфрия Великого. В народе этот день часто называли Петр Поворот, так как с Петра Афонского солнце на зиму, а лето на жары поворачивает. В прежние времена принято было сеять в этот день до обеда какое-нибудь белое зерно, а после обеда - чёрное (гречку). Исполнение этого правила гарантировало удачу. В этот день выпадают большие росы. Наши предки приметили, если дождь идет маленькими каплями - будет идти долго.",poltava
176,Понедельник,26,июня,04:34,20:55,+30°,+20°,34.5°, 1957,7.7°, 1969 ,  В Полтаве на протяжении всего дня стояла облачная погода. Без осадков.  ," Народный прогноз погоды: В этот день почитается память мученицы Акелины (Акулины). В народе этот день называли: Акулина Гречишница (в это время сеют гречу), Акулина - Кривые огурцы (в это время еще можно сеять огурцы, но красивыми они уже не будут). С Акулины лютуют мошкара, комары, оводы, слепни, мухи. «Мошкара толчется кругами - к хорошей погоде». Наши предки вечером 26 июня следили за луной: если она в белом кругу, то будет дождь. Конец «воробьиным ночам». В это время зацветает барбарис.",poltava
177,Вторник,27,июня,04:34,20:55,+29°,+21°,34.2°, 1954,8.3°, 1944 ,  В Полтаве солнце в этот день редко показывалось из-за облаков. Ночной дождь c грозой утром сменился дождем. Ближе к полудню осадки прекратились.  ," Народный прогноз погоды: 27 июня отмечается день памяти святого пророка Елисея. Наши предки боялись дождя в этот день, поскольку он обещал еще семь недель непогоды. Предсказывать погоду в этот день могла и рыба: если она играет в реке - ночью может быть гроза.",poltava
178,Среда,28,июня,04:35,20:54,+28°,+20°,33.5°, 1961,10.8°, 1944 ,"  Небо днем затянуло облаками, и вечером погода оставалась пасмурной. Без осадков.  "," Народный прогноз погоды: В этот день почитается память мучеников Вита (Фита) и Модеста. Святому Модесту молятся на случай падежа скота. В народе говорили, что на Вита соловей замолкает. Наши предки заметили, что «Дождь на Фита - плохо для жита». По примете, день 28 июня желателен солнечный, так как в случае дождливой и ненастной погоды в доме будет разлад и склоки. В прежние времена приметили, если во время восхода солнца стоит духота - к ненастью.",poltava
179,Четверг,29,июня,04:35,20:54,+32°,+18°,34.7°, 1954,9.3°, 1953 ,  Ясной погодой нас этот день не порадовал - в Полтаве тучи закрыли небо уже с самого утра и никуда не делись до позднего вечера. Без осадков.  ," Народный прогноз погоды: 29 июня отмечается день памяти святителя Тихона Амафунтского. В народе говорили: «На Тихона солнце идет тише». Это считается самый тихий день в году. С Тихона кончается молодое лето, наступает зрелое. В этот день устраивали пир для тружеников, которые унавоживали поля. Эти люди были очень нужны, потому что: ""Где лишняя навоза колыжка, там лишняя хлеба коврижка"". Наши предки приметили, если пчелы утром играют - будет ясный день, толкутся - к ненастью.",poltava
180,Пятница,30,июня,04:36,20:54,+30°,+21°,34.9°, 1954,8.4°, 1961 ,"  С самого утра небо в Полтаве покрылось облаками, которые продержались до конца дня. Без осадков.  "," Народный прогноз погоды: 30 июня почитается память священномучеников Мануила и Исмаила. В прежние времена говорили: «На Мануила солнце застаивается (медлит в зените)». Эту народную примету подтверждают данные астрономов: действительно, к этому времени Земля сбавляет скорость движения вокруг Солнца. На ночном небе в это время видны зарницы. Наши предки в этот день прислушивались к деревьям: если сосна звенит, а дуб - стонет, значит бурю не миновать.",poltava
181,Суббота,1,июля,04:37,20:54,+34°,+22°,32.7°, 1991,9.9°, 1963 ,"  Вечером в Полтаве держалась пасмурная погода, днем было небольшое прояснение, но оно оказалось недолгим. Без осадков.  "," Народный прогноз погоды: 1 июля почитается память мучеников Леонтия, Ипатия и Федула. В давние времена 1 июля отмечался Ярилин день - день палящего солнца. По этому поводу организовывались народные гуляния. Наши предки в этот день наблюдали за травой: если утром она сухая - к ночи ожидай дождя. В это время отцветает малина, начинают цвести лилии.",poltava
182,Воскресенье,2,июля,04:37,20:54,+27°,+18°,33.6°, 1991,8.7°, 1951 ,"  В Полтаве на протяжении всего дня стояла облачная погода. Ночью пошел дождь, но ближе к утру он закончился. До завершения дня осадков больше не наблюдалось.  "," Народный прогноз погоды: 2 июля отмечается день памяти мученика Зосимы. В народе Зосима считается покровителем пчел. С этого времени пчелы начинают заносить мед, заливать соты. Поскольку день посвящен этим трудолюбивым насекомым, то и погоду наши предки определяли по их поведению. Так вот: когда пчелы сильно летят к своим ульям, то скоро дождь; становятся злее, чаще жалят - перед засухою; сидят на стенках улья - к сильной жаре.",poltava
183,Понедельник,3,июля,04:38,20:53,+26°,+18°,33.5°, 1991,7.9°, 1957 ,"  Уже утром небо в Полтаве затянуло облаками, которые так и не исчезли до конца дня. Без осадков.  "," Народный прогноз погоды: В этот день почитается память священномученика Мефодия, епископа Патарского. В народе этот день называли Паутинный, потому что погоду предсказывал паук. Если в этот день он не раскидывает сетей - будет дождь или буря. А если снова плетет паутину - перемена погоды к лучшему. Очень часто этот день бывает дождливый, с грозой. Дождь в этот день мог ""предсказать"" не только паук. Если муравьи прячутся в кучи - жди сильного ветра, дождя, грозы; жаба в траву выползла - тоже ожидай дождя.",poltava
184,Вторник,4,июля,04:39,20:53,+20°,+15°,34.8°, 1959,10.7°, 1960 ,  Весь день в Полтаве было облачно. Без осадков.  ," Народный прогноз погоды: 4 июля отмечается день священномученика Терентия, епископа Иконийского. В прежние времена заметили, если этот день жаркий, то декабрь будет морозным. В это время зацветает липа.",poltava
185,Среда,5,июля,04:40,20:52,+22°,+13°,33.1°, 1970,8.4°, 1976 ,"  Небо днем затянуло облаками, и вечером погода оставалась пасмурной. Без осадков.  "," Народный прогноз погоды: В этот день почитается память священномученика Евсевия, епископа Самосатского. Наши предки в этот день ожидали дождя, так как он указывал на хороший урожай хлебов. Хороший урожай обещал и месяц, который играет вечером. А утром наблюдали за туманом: если он стелется по воде - будет хорошая погода.",poltava
186,Четверг,6,июля,04:40,20:52,+22°,+14°,32.2°, 1968,9.0°, 1976 ,"  В этот день в Полтаве с утра и до самого вечера сохранялась пасмурная погода. Весь день прошел без осадков, только вечером начался дождь.  "," Народный прогноз погоды: 6 июля отмечается день Владимирской иконы Божией Матери. Также в этот день почитается память священномученицы Агриппины. В народе святую называли Аграфена Купальница, потому что в этот день начинались купанья. Пожалуй, самым главным событием дня Аграфены Купальницы был сбор трав, кореньев для лечебных и знахарских целей. Чтобы узнать погоду на ближайшее будущее, наши предки в этот день следили за воронами: если они под тучи взвиваются - к ненастью.",poltava
187,Пятница,7,июля,04:41,20:51,+22°,+11°,34.6°, 1999,8.2°, 1952 ,  В Полтаве утреннее прояснение не сделало большой погоды на фоне облачного в целом дня. Без осадков.  ," Народный прогноз погоды: 7 июля отмечается Рождество честного славного Пророка, Предтечи и Крестителя Господня Иоанна. Это один из самых почитаемых народом праздник. С 7 июля наши предки начинали сенокос, пока трава не осеменилась. Наши предки заметили, если на Ивана сильная роса - к урожаю огурцов. В прежние времена говорили, если в этот день будет дождь, то через пять дней солнышко будет светить. Дождь на Ивана Купала считался благодатным.",poltava
188,Суббота,8,июля,04:42,20:51,+22°,+11°,35.3°, 2002,8.7°, 1952 ,  Облачный день и пасмурный вечер пришли в Полтаве на смену ясному утру. Без осадков.  ," Народный прогноз погоды: В этот день почитается память святого благоверного князя Петра и княгини Февронии, муромских чудотворцев. Святые супруги прославились благочестием и милосердием. Петр и Феврония скончались в один день и час. Они - образец христианского супружества. Наши предки заметили, с этого дня следует ожидать еще сорок жарких дней.",poltava
189,Воскресенье,9,июля,04:43,20:50,+22°,+14°,36.8°, 2002,8.8°, 1952 ,  В Полтаве облачная погода продержалась весь день. Без осадков.  ," Народный прогноз погоды: 9 июля отмечается день иконы Тихвинской Божьей Матери. Также в этот день почитается память преподобного Давида Солунского. В народе святого называют Земляничником, так как к этому времени поспевает земляника. У наших предков существовало поверье: кто хочет занять денег, тот должен положить травы земляники в карман и смело идти - отказа не будет. Чтобы узнать погоду, в прежние времена следили за травой: если утром она сухая, к ночи следует ожидать дождя.",poltava
190,Понедельник,10,июля,04:44,20:49,+27°,+16°,35.8°, 2002,8.4°, 1958 ,  Облачная погода продержалась в Полтаве до самого вечера. Без осадков.  ," Народный прогноз погоды: 10 июля отмечается день памяти преподобного Сампсона Странноприимца. В народе известно такое название этого дня - Самсон Сеногной, потому что часто 10 июля бывают дожди, что, в свою очередь, портит заготовку сена. Если дождь в этот день случается, то будет он идти до Бабьего лета. А если погода хорошая, солнечная, то продержится она еще семь недель.",poltava
191,Вторник,11,июля,04:45,20:49,+29°,+16°,36.6°, 1996,9.9°, 1946 ,"  Порадовав нас безоблачным утром, погода изменилась уже в середине дня, и небо в Полтаве было пасмурным до позднего вечера. Без осадков.  "," Народный прогноз погоды: В этот день почитается память преподобных Сергия и Германа, Валаамских чудотворцев. С этого дня уже можно копать ранний картофель. В прежние времена заметили, что на кануне Петрова дня (12 июля) солнце необычайно горело, разливалось красками. В этот день наши предки слушали кукушку: если она переставала куковать - зима рано придёт.",poltava
192,Среда,12,июля,04:46,20:48,+29°,+20°,36.2°, 1996,10.7°, 1961 ,  Весь день в Полтаве было облачно. Без осадков.  ," Народный прогноз погоды: 12 июля отмечается день памяти славных и всехвальных первоверховных святых апостолов Петра и Павла. Этот день считается макушкой лета. Наши предки заметили, если ясно на Петров день - год будет хорошим, а если дожди - 40 дней еще будет ненастье. Чаще всего этот день сухой, жаркий, светлый. По этому поводу существовала поговорка: «Петр-Павел жару прибавил». Если кукушка кукует после Петрова дня, то, значит, лето будет хорошее, долгое и снег нескоро выпадет.",poltava
193,Четверг,13,июля,04:47,20:47,+24°,+20°,32.2°, 1951,10.2°, 1987 ,"  На протяжении всего дня небо в Полтаве было покрыто облаками. Утром и днем шел дождь, вечером был дождь c грозой.  "," Народный прогноз погоды: В этот день отмечается собор святых славных и всехвальных 12 апостолов: Петра, Андрея, Иакова Зеведеева, Иоанна, Филиппа, Варфоломея, Фомы, Матфея, Иакова Алфеева, Иуды Иаковля, Симона Зилота и Матфия. Наши предки прислушиваться к кукушке: если она продолжает куковать - лето будет хорошее и долгое.",poltava
194,Пятница,14,июля,04:48,20:46,+23°,+16°,32.3°, 2002,11.4°, 1968 ,"  В Полтаве солнце в этот день редко показывалось из-за облаков. Ночью был дождь c грозой, но уже к утру он закончился. Больше осадков не наблюдалось.  "," Народный прогноз погоды: 14 июля отмечается день памяти святых чудотворцев бессребренников Космы и Дамиана. В крестьян в это время начинался сенокос: «Кузьма и Демьян пришли - на покос пошли». К этому времени поспевает малина, первые овощи. Наши предки на Кузьму и Демьяна варили варенье из крыжовника. В прежние времена заметили, хорошая погода 14 июля обещает хорошую погоду 14 ноября, а если будет плохая погода в этот день, то и 14 ноября ничего хорошего не жди.",poltava
195,Суббота,15,июля,04:49,20:45,+20°,+13°,34.6°, 1951,10.5°, 1968 ,  На протяжении всего дня погода в Полтаве была пасмурной. Утром был мелкий дождь. День и вечер прошли без осадков.  ," Народный прогноз погоды: В этот день почитается память святителя Фотия, митрополита Киевского. В прежние времена в этот день был еще праздник Берегини. Берегиня почиталась хранительницей от зла и защитницей здоровья. К этому времени поспевает рання вишня. Наши предки заметили, если к 15 июля на деревьях «проглянут» первые желтые листья - осень наступит рано и зима будет ранней. В период с 15 по 20 июля в реках и водоемах начинает цвести вода.",poltava
