,infoDayweek,infoDate,infoMonth,sunUp,sunDown,tempMax,tempMin,maxTemp,maxYear,minTemp,minYear,dayInfo,dayHistory,city
0,Воскресенье,1,января,08:36,16:54,-1°,-5°,9.6°, 1971,-25.7°, 1970 ,"  Облачная погода продержалась в Полтаве до самого вечера. Утро и день прошли без осадков, только ближе к вечеру начался сильный дождь со снегом.  "," Народный прогноз погоды: В этот день почитается память святого Бонифатия. Народная примета гласит: «Каков первый день января, таков и первый день лета». Принято было считать, если первый день в году веселый (счастливый), то и год будет таким же (и наоборот). На погоду в этот день указывали птицы: если синички с утра пищат — к морозу, если воробьи нахохлились, следует ожидать непогоды. Также в старину заметили, если утром густой иней на деревьях, то год будет урожайным.",poltava
1,Понедельник,2,января,08:36,16:55,+2°,-2°,6.1°, 1965,-25.4°, 1963 ,"  В Полтаве утренние облака быстро исчезли, и начиная с середины дня погода оставалась ясной. Ночью был мелкий дождь, но уже к утру он закончился. Больше осадков не наблюдалось.  "," Народный прогноз погоды: 2 января почитается память святого Игнатия Богоносца. Погода этого дня предсказывает погоду августа. Наши предки подметили: насколько сильный мороз в этот день, настолько жарко будет летом. А если есть иней на деревьях, то погода в ближайшие дни будет ясной. В старину был обычай на Игнатия вокруг дома обносить иконы, защищая таким образом дом от зла. В этот день садоводы трясут плодовые деревья, чтобы хороший урожай был.",poltava
2,Вторник,3,января,08:36,16:56,+1°,-3°,6.2°, 1965,-26.7°, 1947 ,  В Полтаве солнце в этот день редко показывалось из-за облаков. Утром пошел сильный дождь со снегом и закончился в середине дня. Больше осадков не наблюдалось.  ," Народный прогноз погоды: По астрономическому календарю 3 января Земля находится в перигелии — она отстоит на наименьшем расстоянии от Солнца. Наши предки приметили, каков день 3 января, таким будет и сентябрь. Красное солнце на утренней зорьке предвещает метель. Если в этот день много снега, то можно ожидать хорошего урожая хлеба, а если снег не укроет землю к этому дню, то урожай в грядущем году будет скудным.",poltava
3,Среда,4,января,08:35,16:58,0°,-6°,7.4°, 1961,-28.3°, 1947 ,"  Ясной погодой нас этот день не порадовал - в Полтаве тучи закрыли небо уже с самого утра и никуда не делись до позднего вечера. Утро и день прошли без осадков, только ближе к вечеру начался снег.  "," Народный прогноз погоды: 4 января отмечается день Анастасии Узорешительницы. К этой святой обращались в молитвах для легкого течения беременности и родов. В этот день, с молитвами к святой, женщины вышивали полотенце, которое должно было помочь благополучно разрешиться от бремени. В народе приметили, каким день будет на Анастасию, таким будет и октябрь. Наши предки в этот день следили за облаками, если они шли против ветра, то ожидали снегопада.",poltava
4,Четверг,5,января,08:35,16:59,+1°,-4°,5.7°, 1952,-26.7°, 1947 ,  На протяжении всего дня небо в Полтаве было покрыто облаками. Ночью и утром шел снег.  ," Народный прогноз погоды: 5 января почитается память святых Феодула, Саторнина и других. С этого дня уже начиналась активная подготовка к Рождественским праздникам: принято было убрать дом и готовить кутью. Наши предки по погоде этого дня предсказывали погоду ноября. Для этого дня характерна ветреная погода, поэтому в старину говорили: «Пришёл Федул, ветер подул» — это предвещало хороший урожай. Благоприятным признаком для урожая считаются ясные дни во время всего Рождественского поста (28 ноября — 6 января).",poltava
5,Пятница,6,января,08:35,17:00,-4°,-10°,6.3°, 1975,-25.6°, 1987 ,"  На протяжении всего дня погода в Полтаве была пасмурной. Днем начался сильный дождь со снегом, которому вечером на смену пришел мелкий снег.  "," Народный прогноз погоды: 6 января все православные народы празднуют Рождественский сочельник. С этого дня наступают Рождественские морозы. Глубоко промёрзшая земля предвещает плодородие. По погоде этого дня предсказывают погоду декабря. Если в этот день тепло — весна будет холодной; метель — к урожаю пшеницы. В народе говорили: «Коли на Кутью небо звездисто — богатый приплод скота и много ягод будет». Если на сочельник случился снегопад, жди процветания хозяйства в новом году, а если мороз — в семье будет совет да любовь.",poltava
6,Суббота,7,января,08:34,17:01,-9°,-13°,7.6°, 2001,-26.4°, 1979 ,"  На протяжении всего дня погода в Полтаве была пасмурной. Утром и днем был снег, ближе к вечеру ему на смену пришел сильный дождь со снегом.  "," Народный прогноз погоды: 7 января отмечается Рождество — один из главных христианских праздников. С прежних времен это день примирения, доброты, миролюбия, прославления Христа. Наши предки приметили, если в этот день тепло — весна будет холодная. Если же в день Рождества холодно и вьюга, будет холодно и летом. Густой иней и снег в этот день предвещали летом изобилие хлеба и малины. Несмотря на торжество этого праздника, светлый, ясный день указывал на неурожай. А много звезд на небе — на урожай грибов, ягод и гороха.",poltava
7,Воскресенье,8,января,08:34,17:02,-6°,-11°,6.7°, 2001,-23.4°, 1987 ,"  Облачная погода продержалась в Полтаве до самого вечера. Утром продолжился ночной сильный дождь со снегом, но ближе к полудню он закончился.  "," Народный прогноз погоды: 8 января отмечается Собор Пресвятой Богородицы. В народе этот день назывался Бабьи каши. По каше и погоду предсказывали на ближайшее время: если каша в печи румянится — к снегу. Если до этого времени земля еще хорошо не промерзла, то летом соку не даст, то есть урожай будет не очень хорошим. Наблюдали в этот день за солнцем и за птицами: если около солнца появлялась светлая полоса, это предвещало снег. Если синица с утра пищит — быть морозу ночью, а если галки и вороны устроили непрекращающийся гвалт — быть снегопаду или метели.",poltava
8,Понедельник,9,января,08:34,17:04,-4°,-8°,9.0°, 2001,-26.2°, 1950 ,"  В Полтаве на протяжении всего дня стояла облачная погода. Утром был сильный дождь со снегом, который после полудня ослабел, а ближе к вечеру ему на смену пришел снег.  "," Народный прогноз погоды: 9 января почитается память святого апостола Стефана, который проповедовал, подкрепляя истинность своих слов знамениями и чудесами. Обычно этот день бывал морозным: «Пришел Стефан — на нем красный жупан». Наши предки заметили, что если в этот день снег валится с неба большими хлопьями, то в ближайшем будущем нужно от погоды ожидать ненастье и слякоть.",poltava
9,Вторник,10,января,08:33,17:05,-4°,-5°,9.1°, 2001,-25.6°, 1950 ,"  В Полтаве облачная погода продержалась весь день. Ночью и утром шел снег, после полудня начался дождь со снегом. Вечером осадки прекратились.  "," Народный прогноз погоды: В этот день почитается память святых из Никомидии. Наши предки заметили, что погода в этот день указывает на погоду в июле будущего года. Если 10 января случатся снегопады и метели, то в июле будут частые дожди. Если в этот день скирды хлеба были покрыты инеем, это тоже был верный знак того, что будущее лето будет дождливым.",poltava
10,Среда,11,января,08:33,17:06,-2°,-4°,9.4°, 2005,-31.9°, 1950 ,"  Весь день в Полтаве было облачно. Весь день прошел без осадков, только вечером начался дождь со снегом.  "," Народный прогноз погоды: 1 ноября отмечается день памяти святого Садока, епископа Персидского. Издавна первый день ноября считался проводами осени, встречей зимы и отмечался повсюду. Если в этот день будет холодно и пойдет снег, то весна будет поздняя и холодная, а если сегодня случится оттепель — в следующем году весна будет теплой и ранней.",poltava
11,Четверг,12,января,08:32,17:08,0°,-8°,8.2°, 2005,-29.2°, 1950 ,"  На протяжении всего дня погода в Полтаве была пасмурной. Утром пошел сильный дождь со снегом, который закончился еще до середины дня. Больше осадков не было.  "," Народный прогноз погоды: 12 января почитается память святой Анисии. В народе этот день назывался «Анисьи зимние» или «Анисьи Желудочницы». В старину в этот день варили свиные желудки и резали гусей. По внутренностям животных гадали о зиме. Если селезенка была ровной и гладкой, то ожидали зимы суровой. Толстая печень в середине означала, что стужи начнутся с половины зимы, а широкая сторона печени к брюху обещала морозы и перезимья. В народе говорили: «Ко дню Анисьи холода над землей повисли».",poltava
12,Пятница,13,января,08:31,17:09,-2°,-10°,6.3°, 2005,-25.0°, 1972 ,  На протяжении всего дня погода в Полтаве была пасмурной. Без осадков.  ," Народный прогноз погоды: 13 января отмечается день памяти преподобной Мелании Римляныни. В народе называют этот день «Щедрый вечер». Погода каждого последующего дня соответствовала погоде каждого из двенадцати месяцев. Если в ночь ветер дул южный, то год ожидали жаркий и урожайный. Западный ветер предвещал хорошие надои и обилие рыбы, а восточный — обильный урожай фруктов. Если замечали на окнах лёд, то рассчитывали на обилие мёда. С этого времени день прибывает на час.",poltava
13,Суббота,14,января,08:31,17:10,+2°,-5°,5.1°," 1955, 2007",-26.3°, 1950 ,"  В Полтаве солнце в этот день редко показывалось из-за облаков. Утро и день прошли без осадков, только ближе к вечеру начался дождь.  "," Народный прогноз погоды: 14 января почитается память святителя Василия Великого, архиепископа Кесарии Каппадокийской. Если на Василия с утра туман, то будет хороший урожай летом и осенью. Если будет много звезд на небе — будет много ягод летом. В прежние времена говорили: «Коли Васильев день в году веселый, то и год таков», «Старый год — к весне поворот». Если на Василия тепло и снег — лето будет теплым и дождливым.",poltava
14,Воскресенье,15,января,08:30,17:12,+1°,-4°,4.7°," 1981, 2007",-25.0°, 1954 ,"  В Полтаве облачная погода продержалась весь день. Ночью был дождь, утром - сильный дождь со снегом, который после полудня сменился снегом. Только ближе к вечеру осадки прекратились.  "," Народный прогноз погоды: 15 января почитается память святителя Сильвестра Римского, преподобных Сильвестра Печерского и Серафима Саровского. В прежние времена в этот день был Куриный праздник. 15 января чистили курятники и окуривали их смолою с девясилом. Синие вечерние облака в этот день предвещали перемену погоды. Наблюдали также за месяцем: если его рога остры и ярки, следует ожидать ветра. В народе говорили: «Январь гонит вьюгу за семь верст» — этот месяц хоть и холодный, но относительно спокойный.",poltava
15,Понедельник,16,января,08:29,17:13,-1°,-8°,4.7°, 1983,-24.5°, 1972 ,"  Хмурое утро сменилось в Полтаве ясным днем, и безоблачным небо оставалось до глубокого вечера. Без осадков.  "," Народный прогноз погоды: В этот день почитается память святого пророка Малахии. По народному поверью, только в этот день можно образумить одержимого меланхолией человека. И если сейчас меланхоличность считается чертой характера, то в прежние времена это считалось душевной болезнью. Если в этот день на небе появлялось белое большое облако, это предвещало вьюгу и метель. Погода на Малахию указывает, какой будет погода в марте.",poltava
16,Вторник,17,января,08:28,17:15,-7°,-11°,5.7°, 1955,-23.2°, 1976 ,  Весь день в Полтаве было облачно. Без осадков.  ," Народный прогноз погоды: 17 января почитается память преподобного Феоктиста, Зосимы Пустынника, который жил в IV веке. В народе Зосима считается покровителем пчел. О пчелах толкует и примета этого дня: если в этот день «снег на деревьях сучья гнет — летом пчелы роиться будут». А если на небе нет облаков при сильном морозе, то морозная погода будет стоять и дальше и не скоро отступит.",poltava
17,Среда,18,января,08:27,17:16,-5°,-10°,6.6°, 1965,-24.1°, 1972 ,  На протяжении всего дня небо в Полтаве было покрыто облаками. Без осадков.  ," Народный прогноз погоды: 18 января отмечается Крещенский сочельник, канун Богоявления. В этот день соблюдается строгий пост, поэтому канун Богоявления называют еще Голодной кутёй. Если в этот день метель, снег и позёмка — быть хорошему урожаю. Если звездная ночь на Крещение — будет урожай ягод, гороха и хлеба. Сильные южные ветры 18 января предвещают грозное лето, а метель на Крещение приносит метель и на Масленицу. Полный месяц в этот день обещает большой разлив рек весной.",poltava
18,Четверг,19,января,08:26,17:18,-6°,-12°,4.3°," 1993, 2007",-26.0°, 1950 ,"  В Полтаве все время стояла облачная погода, днем облака ненадолго рассеялись, но вечером снова собрались. Без осадков.  "," Народный прогноз погоды: 19 января отмечается праздник Крещения Господня или Богоявления. По погоде этого дня во многом судили о погоде на лето. Если в этот день холодная, ясная погода — лето засушливым будет. Пасмурная и снежная погода указывала на обильный урожай. В старину говорили: «День тёплый — хлеб тёмный (густой)», значит следовало ожидать хорошего урожая хлебов. Также на хороший урожай указывали синие облака и снег хлопьями.",poltava
19,Пятница,20,января,08:25,17:19,-4°,-10°,6.4°, 1948,-27.2°, 1950 ,  В Полтаве облачная погода продержалась весь день. Вечером был сильный дождь со снегом.  ," Народный прогноз погоды: 20 января отмечается Собор Предтечи и Крестителя Господня Иоанна. Этот день является концом святок: «Иван Креститель праздники увел». Если в этот день стояла ясная и холодная погода, то лето ожидалось засушливое, а пасмурная и снежная погода намекала на обильный урожай. К 20-му января заканчивались Крещенские морозы, и хотя впереди еще была почти половина зимы, люди уже жили в ожидании тепла: «Трещи, мороз не трещи — минули Водохрещи: дуй, вьюга, не дуй — к Великодню пошло».",poltava
20,Суббота,21,января,08:24,17:21,0°,-4°,6.9°, 2005,-25.0°," 1973, 2006 ","  На протяжении всего дня погода в Полтаве была пасмурной. Ночью пошел снег, который утром ослабел. Днем на какое-то время осадки прекратились, а вечером снег начались снова.  "," Народный прогноз погоды: 21 января почитается память Емилиана, исповедника. Раньше метели и бураны в этот день были обычным явлением, о чём говорит и пословица: «Емельян, накрути буран». Следили в этот день в основном за ветром: если на Емельяна подует с юга — лето будет грозным, а если день выдастся ясным, то следует ожидать засушливого лета.",poltava
21,Воскресенье,22,января,08:23,17:23,-3°,-8°,9.6°, 1948,-24.7°," 1973, 2006 ","  В Полтаве днем на небе появились облака, которые к вечеру рассеялись. Без осадков.  "," Народный прогноз погоды: В этот день почитается память святого Полиевкта. В народе про этот период января говорили так: «Растет день в январе — растет и холод», что указывало на приближение месяца февраля, который считался самым холодным месяцем зимы. Наблюдали наши предки в этот день за домашним скотом: если домашний скот, выпущенный во двор, будет стремиться вернуться в хлев — быть вскоре снегу и холоду.",poltava
