,infoDayweek,infoDate,infoMonth,sunUp,sunDown,tempMax,tempMin,maxTemp,maxYear,minTemp,minYear,dayInfo,dayHistory,city
95,Четверг,6,апреля,06:05,19:22,+17°,+9°,24.4°, 1975,-5.9°, 1963 ,  На протяжении всего дня погода в Полтаве была пасмурной. Без осадков.  ," Народный прогноз погоды: 6 апреля отмечается Канун Благовещения и почитается память преподобного Захарии монаха. В народе этот день назывался Похвалы Богородицы: «На похвал Богородицы и птичка похваляется первым яичком». В старину приметили: если ночь на Захария теплая - весна дружная будет; если сойдет к этому дню снег, значит насовсем, если нет - пролежит еще неделю.",poltava
96,Пятница,7,апреля,06:03,19:24,+17°,+8°,25.2°, 1975,-6.7°, 1963 ,  На протяжении всего дня небо в Полтаве было покрыто облаками. Без осадков.  ," Народный прогноз погоды: 7 апреля отмечается праздник Благовещенья Пресвятой Богородицы. «На Благовещение весна зиму поборола», - считают в народе, хотя известны и знаменитые благовещенские морозы. В этот день происходит третья встреча весны. Если 7 апреля ветер, иней и туман - к урожайному году. Если снег на крышах есть, так будет он еще через месяц в поле. Если Благовещенье холодное - жди сорок морозов по утрам. На Благовещение гроза - к теплому лету. Небо безоблачное, солнце яркое - быть лету грозному; оттепель - много морозов впереди. Если на Благовещенье ночь теплая - весна ранняя будет. Для рыболовов этот день хорош - на Благовещенье рыба хорошо ловится.",poltava
97,Суббота,8,апреля,06:01,19:25,+11°,+6°,29.1°, 1975,-3.3°, 1955 ,"  Весь день в Полтаве было облачно. Утро и день прошли без осадков, только ближе к вечеру начался дождь.  "," Народный прогноз погоды: В этот день отмечается Собор Архангела Гавриила и почитается память преподобного Василия Нового. Женщины же в этот день оканчивали последнюю пряжу, а тем, кто продолжал прясть, говорили: «Не пойдёт впрок». Если в этот день восход светел, значит скоро снег полностью сойдет. Наши предки приметили, какова погода 8 апреля — такова она будет 8 октября, и наоборот.",poltava
98,Воскресенье,9,апреля,05:58,19:27,+10°,+6°,25.5°, 1961,-4.0°, 1969 ,"  На протяжении всего дня погода в Полтаве была пасмурной. Утром продолжился ночной дождь, но ближе к полудню он закончился.  "," Народный прогноз погоды: 9 апреля почитается память мученицы Матроны Солунской. В народе святую называют Матрена Настовница, потому что в это время бывают утренние заморозки - снег от них замерзает, и люди ходят как по «насту». С теплых краев продолжают возвращаться птицы: овсянки, пигалицы, чибисы. Если чибис летит низко - к продолжительной сухой погоде; если он кричит с вечера - к ясной погоде. Если весенний лед тонет или остается на берегу, то лето будет холодным.",poltava
99,Понедельник,10,апреля,05:56,19:29,+14°,+7°,23.6°, 1986,-4.4°, 1997 ,  С утра и до самого вечера небо в Полтаве было скрыто за облаками. Без осадков.  ," Народный прогноз погоды: В этот день церковь чтит память святого преподобного мученика Евстратия Печерского и преподобного Илариона Нового. В прежние времена в этот день, если оканчивались заморозки, выгоняли скот на пастбище. В зависимости от температуры воздуха с этого дня вылетают шмели и комары. Наши предки продолжали наблюдать за птицами и составлять по ним прогноз погоды: если птицы вили гнезда на солнечной стороне, ожидалось холодное лето, если на теневой стороне, то лето обещало быть теплым.",poltava
100,Вторник,11,апреля,05:54,19:30,+16°,+6°,25.0°, 1979,-4.8°, 1954 ,"  Днем в Полтаве было облачно, но к вечеру небо очистилось от туч и оставалось ясным до завершения дня. Без осадков.  "," Народный прогноз погоды: 11 апреля отмечается день памяти преподобного Марка, епископа Арефусийского. Наши предки в этот день следили за гусями: если они высоко летят – воды будет много, низко – к малой осенней воде. Березовым соком наши предки на Марка отпаивали больных: чистили кровь, выгоняли недуги из желудка. В это время ломаются почки у черной смородины, калины, красной бузины.",poltava
101,Среда,12,апреля,05:52,19:32,+11°,+7°,23.3°, 1959,-4.9°, 1954 ,"  Уже утром небо в Полтаве затянуло облаками, которые так и не исчезли до конца дня. Утром пошел дождь, но еще в первой половине дня он закончился.  ", Народный прогноз погоды: 12 апреля почитается память преподобного Иоанна Лествичника. 12 апреля в старину наблюдали за птицами: если дикие утки прилетели жирные – весна будет холодная и долгая; а если вдруг прекращается тяга вальдшнепов — жди скорого похолодания или снега. В это время лопаются почки у клена.,poltava
102,Четверг,13,апреля,05:50,19:33,+16°,+5°,25.3°, 1972,-1.8°, 1965 ,"  Несмотря на ясное утро, днем и вечером в Полтаве погода оставалась пасмурной. Весь день прошел без осадков, только вечером начался дождь.  "," Народный прогноз погоды: Церковь отмечает день святого Ионы, святителя Иннокентия и преподобного Ипатия. В народе Ипатий почитается как разрешитель неплодства и бесчадия. Наши предки продолжали наблюдать за перелетными птицами и делать выводы о предстоящей погоде. Если перелетные птицы хохлятся, то хорошей погоды не жди; прилетев весной, долго не щебечут - к холоду; вдруг примолкли – к грозе.",poltava
103,Пятница,14,апреля,05:48,19:35,+11°,+8°,24.0°, 2005,-2.4°, 1947 ,"  В Полтаве облачная погода продержалась весь день. Дождь начался еще до рассвета, но к середине дня прекратился.  "," Народный прогноз погоды: 14 апреля отмечается день памяти Марии Египетской. В народе святую называли Марья Зажги Снега, Марья - заиграй овражки, Марья - пустые щи. Чтобы узнать о предстоящем лете, наблюдали за ночным небом: если ночь ясная и течёт тёплая вода, то лето будет тёплое и сухое. В это время распускается сирень, выползают лесные муравьи.",poltava
104,Суббота,15,апреля,05:46,19:36,+11°,+6°,24.7°, 1972,-3.9°, 1974 ,  Весь день в Полтаве было облачно. Ночью и утром шел дождь.  ," Народный прогноз погоды: 15 апреля почитается память преподобного Тита чудотворца и мученика Поликарпа. В народе Тита называли Ледоломом, поскольку в это время вскрываются реки. К середине апреля выходили зимние запасы. В народе говорили: «Ничего нет, ни крохи, ни зерна, ни капли»; «Поликарпов день - начало бесхлебицы». Наши предки считали: если в этот день вешние воды текут медленно, лед тонет, значит будет тяжело народу в этом году.",poltava
105,Воскресенье,16,апреля,05:44,19:38,+13°,+7°,25.7°, 1972,-2.8°, 1971 ,  Весь день в Полтаве было облачно. Без осадков.  ," Народный прогноз погоды: В это время наши предки продолжали следить за льдом: если он на озерах потонет - год будет тяжелым. Садоводы уже начинали сажать груши, сливы, смородину, обрезать деревья и кустарники.",poltava
106,Понедельник,17,апреля,05:42,19:39,+9°,+5°,22.7°, 1972,-3.1°, 1949 ,"  С утра и до самого вечера небо в Полтаве было скрыто за облаками. Ночью пошел дождь, но ближе к утру он закончился. До завершения дня осадков больше не наблюдалось.  "," Народный прогноз погоды: 17 апреля отмечается день памяти преподобного Иосифа, песнописца и творца канонов. На Иосифа начинает звучать голосок сверчка и впервые подает голос журавль. В старину выходили в этот день из домов, обращались к журавлям как к борцам со злом и защитникам от нечисти. Наши предки приметили, если днем 17 апреля жарко, а ночью прохладно – к хорошей погоде.",poltava
107,Вторник,18,апреля,05:40,19:41,+6°,+1°,24.5°, 1994,-3.7°, 1981 ,"  На протяжении всего дня погода в Полтаве была пасмурной. Во второй половине дня пошел дождь со снегом, который продолжался до самого вечера.  "," Народный прогноз погоды: 18 апреля почитается память святого мученика Феодула, чтеца. В народе святого называли Федул Ветреник: «Пришел Федул - тепляк подул». Если в этот день было ненастье, то говорили: «Федул губы надул». До этого дня еще вполне вероятны морозы, но после Федула власть зимы уже утеряна на долгое время. В этот день приходит первое настоящее тепло и просыпаются сверчки.",poltava
108,Среда,19,апреля,05:38,19:42,+4°,0°,24.9°, 1950,-4.2°, 1945 ,"  С утра и до самого вечера небо в Полтаве было скрыто за облаками. На протяжении всего дня шел дождь со снегом, который ближе к вечеру закончился.  "," Народный прогноз погоды: В этот день почитается память святого преподобного Евтихия, архиепископа Константинопольского. В народе святого Евтихия называли Тихим, поскольку погода в этот день чаще всего бывала именно такой. Когда выдавался и вправду тихий день, то крестьяне примечали: ""Это - к урожаю ранних хлебов"".",poltava
109,Четверг,20,апреля,05:36,19:44,+3°,-1°,23.8°, 1950,-3.4°, 1945 ,  В этот день в Полтаве с утра и до самого вечера сохранялась пасмурная погода. Без осадков.  ," Народный прогноз погоды: 20 апреля отмечается день памяти святого мученика Руфина, диакона и девицы Акилины и с ними 200 воинов. Если на Акулину дождь, то яровые будут плохие, а калина уродится хорошая. С этого времени появляются первые грибы - сморчки. Наши предки на Акилину наблюдали за небом: если на нем было много звезд - это обещало хороший урожай грибов и ягод.",poltava
110,Пятница,21,апреля,05:34,19:46,+2°,0°,26.8°, 1950,-3.5°, 1945 ,"  В Полтаве солнце в этот день редко показывалось из-за облаков. Начиная с середины дня шел сильный дождь со снегом, который к вечеру стал слабее.  "," Народный прогноз погоды: 21 апреля почитается память святых апостолов Иродиона, Агава, Руфа, Асигкрита, Флегонта, Ерма. В народе этот день называли Родион Выверни Оглобли, Родион Ледолом, Ревучие воды. Наши предки примечали: если рассвет на Руфу ясный, то лето будет хорошее, если хмуро, то лето будет ненастное, а если туманно - быть летом непогоде, а если будет теплый вечер и тихая ночь, лето будет жарким и сухим.",poltava
111,Суббота,22,апреля,05:32,19:47,+12°,0°,28.3°, 1950,-2.9°, 1948 ,"  В Полтаве солнце в этот день редко показывалось из-за облаков. Ночной дождь со снегом закончился еще до наступления утра. Днем осадков не наблюдалось, а вечером пошел дождь.  "," Народный прогноз погоды: В этот день почитается память святого мученика Вадима, архимандрита. В старину с этого дня начинался выгон скота в поле. У крестьян была традиция 22 апреля обходить родники и ключи и приговаривать ""Подземная водица, отмыкаем тебе пути вешние"". Наши предки заметили, что можно ожидать сухого лета, если к этому дню еще не установилась стабильная теплая погода.",poltava
112,Воскресенье,23,апреля,05:30,19:49,+12°,+5°,29.3°, 1950,-1.4°, 1945 ,  На протяжении всего дня небо в Полтаве было покрыто облаками. Без осадков.  ," Народный прогноз погоды: 23 апреля отмечается день памяти святых мучеников Терентия, Помпия и других. В этот день в старину наблюдали за солнцем: «Если солнце взойдет красное в туманной дымке - год будет хлебородным. Если выкатится из-за горы - придется перепахивать озимое поле да засевать яровиной». В это время раскрываются почки у груши, у дуба. Всходят нарциссы, крокусы, а при ранней и теплой весне могут зацветать.",poltava
113,Понедельник,24,апреля,05:29,19:50,+10°,+3°,23.3°, 1989,-2.8°, 1954 ,"  В Полтаве на протяжении всего дня стояла облачная погода. Первая половина дня прошла без осадков. После обеда начался дождь, но он закончился еще до наступления вечера.  "," Народный прогноз погоды: 24 апреля почитается память святого мученика Антипа, епископа Пергамо-Асийского. Антипу называли Половодом и говорили: «Антип воды распустил», «Антип без воды (холод) - закрома без зерна (лето плохое)». Наши предки заметили: «если к этому дню воды не вскрылись, то весна поздней будет и лето плохим простоит». Если утром мороз, а днём пошёл снег, то ещё целый месяц будет холодно. В этот день медведь из берлоги выходит.",poltava
114,Вторник,25,апреля,05:27,19:52,+13°,+2°,25.6°, 1950,-4.3°, 1948 ,"  Небо в Полтаве днем затянули облака, которые продержались до вечера и уже никуда не исчезли. Без осадков.  "," Народный прогноз погоды: В этот день почитается память святого мученика Василия, исповедника, епископа Парийского. С этого дня становится значительно теплее, земля прогревается, сохнет, поэтому в народе говорили, что ""Василий землю парит"". Наши предки наблюдали за ивой: если она к этому дню распушилась - сильного холода уже не будет. С 25 апреля массово вылетают шмели, летают пчелы. Выходят из нор лисицы.",poltava
115,Среда,26,апреля,05:25,19:53,+16°,+5°,25.5°, 1950,-1.2°, 1948 ,"  Небо в Полтаве было ясным почти весь день, но вечером его затянули облака. Без осадков.  "," Народный прогноз погоды: 26 апреля отмечается день памяти святой мученицы Фомаиды Египетской. В народе Фомаида считается укротительницей страстей. Наши предки наблюдали за выделением березового сока: если у березы было много сока, считалось, что лето дождливым будет. В это время появляются первые весенние цветы (при теплой весне появляются раньше), зеленеет малина.",poltava
116,Четверг,27,апреля,05:23,19:55,+21°,+5°,25.3°, 1966,-3.1°, 2003 ,  В Полтаве облачная погода продержалась весь день. Без осадков.  ," Народный прогноз погоды: 27 апреля почитается память святого Мартина исповедника, папы Римского. В народе святого Мартына называли Лисогоном, также этот день имел название ""Вороний праздник"". В это время лисицы переселяются из старых нор в новые: «На Мартына на лисиц нападает курячья слепота». Наши предки заметили, что если тепло 27 апреля - в первых числах мая надолго похолодает. С этого времени начинаются грозы. Прилетают стрижи и касатки.",poltava
117,Пятница,28,апреля,05:21,19:56,+23°,+8°,25.9°, 1966,-0.1°, 1954 ,"  В целом погода в Полтаве была облачной, лишь ненадолго день порадовал нас ясным небом. Без осадков.  "," Народный прогноз погоды: В этот день почитается память святых апостолов Аристарха, Пуда, Трофима. В этот день осматривают пасеки: «На день святого Пуда доставай пчел из-под спуда». Считалось, что пчелиный рой, залетевший на чужой двор, сулил хозяину дома счастье. На Пуда калина и рябина почки распускают. При нормальной весне в это время распускаются листья на березе. Появляются лягушки. В садах наблюдается раннее цветение вишни.",poltava
118,Суббота,29,апреля,05:19,19:58,+23°,+12°,27.5°, 1970,0.4°, 1954 ,"  Облака, которые появились в Полтаве на небе утром, продержались почти весь день, но к вечеру рассеялись. Без осадков.  "," Народный прогноз погоды: 29 апреля отмечается день памяти святых мучениц Ирины, Агапии и Хионии. В народе святую Ирину называют ""Разрой берега"", поскольку при весенних стоках воды происходят обрывы речных берегов, оползни. Полая вода подмывает берега. Также святую Ирину называли Рассадницей и в этот день сеяли капусту на рассадниках. Наши предки приметили: «Если овражки заиграют и опять замерзнут - жди помехи на урожай».",poltava
119,Воскресенье,30,апреля,05:18,19:59,+25°,+9°,27.6°, 1949,-0.9°, 1961 ,"  Погода была ясной, только к вечеру в Полтаве на небе появились облака. Без осадков.  "," Народный прогноз погоды: 30 апреля почитается память преподобного Зосимы, игумена Соловецкого. Зосима и Савватий считаются в народе покровителями пчел, заступниками пчеловодов. К этому времени уже и берёза и ольха распускаются. Если береза перед ольхой лист распустила, то ждали сухого лета, а если ольха перед берёзой, то пророчили мокрое лето. С 30 апреля по 5 мая можно услышать первое кукование кукушки.",poltava
